{
  "issuer": "https://demo-toyota.example.com/poppy",
  "token_endpoint": "https://demo-toyota.example.com/poppy/oauth/token",
  "revocation_endpoint": "https://demo-toyota.example.com/poppy/oauth/revoke",
  "poppy_domains": [
    "demo-toyota.example.com"
  ],
  "grant_types_supported": [
    "urn:ietf:params:oauth:grant-type:jwt-bearer"
  ],
  "token_endpoint_auth_methods_supported": [
    "private_key_jwt"
  ],
  "dpop_signing_alg_values_supported": [
    "ES256"
  ]
}
